{
  "schema_version": "aigc.quebec-cloud-authorization.v1",
  "environment": "STAGING",
  "provider": "google_cloud",
  "repository": "Lornt1666/AIGC",
  "project_id": "aigc-placeholder-stage",
  "project_number": "123456789012",
  "billing_account_id": "000000-000000-000000",
  "billing_account_currency": "CAD",
  "region": "northamerica-northeast1",
  "region_name": "Montréal, Québec, Canada",
  "resource_prefix": "placeholder-prefix",
  "release_sha": "0000000000000000000000000000000000000000",
  "release_tree_sha": "0000000000000000000000000000000000000000",
  "resource_manifest_sha256": "0000000000000000000000000000000000000000000000000000000000000000",
  "authorization_inventory_sha256": "0000000000000000000000000000000000000000000000000000000000000000",
  "ci_admission_sha256": "0000000000000000000000000000000000000000000000000000000000000000",
  "model": "gemini-2.5-flash",
  "task_type": "canadian_staging_plan",
  "data_classification": "SANITIZED_NON_PERSONAL",
  "rpo_minutes": 15,
  "rto_hours": 4,
  "costs": {
    "currency": "CAD",
    "estimated_one_time": null,
    "estimated_monthly": null,
    "maximum_monthly_ceiling": 200,
    "budget_is_hard_cap": false
  },
  "resources": {
    "artifact_registry_repository": "placeholder_artifact_repository",
    "operator_service": "placeholder_operator_service",
    "judge_service": "placeholder_judge_service",
    "cloud_sql_instance": "placeholder_sql_instance",
    "database_name": "aigc_control",
    "evidence_bucket": "placeholder_evidence_bucket",
    "judge_bucket": "placeholder_judge_bucket",
    "receipt_bucket": "placeholder_receipt_bucket",
    "build_source_bucket": "placeholder_build_source_bucket",
    "log_bucket": "placeholder_log_bucket",
    "kms_key_ring": "placeholder_kms_key_ring"
  },
  "service_accounts": {
    "deployer": "aigc-deployer@aigc-placeholder-stage.iam.gserviceaccount.com",
    "cloud_build": "aigc-cloud-build@aigc-placeholder-stage.iam.gserviceaccount.com",
    "operator": "aigc-operator@aigc-placeholder-stage.iam.gserviceaccount.com",
    "canary_gemini": "aigc-can-gem@aigc-placeholder-stage.iam.gserviceaccount.com",
    "canary_openai": "aigc-can-oai@aigc-placeholder-stage.iam.gserviceaccount.com",
    "canary_provisioner": "aigc-can-prov@aigc-placeholder-stage.iam.gserviceaccount.com",
    "canary_binder": "aigc-can-bind@aigc-placeholder-stage.iam.gserviceaccount.com",
    "canary_executor": "aigc-can-exec@aigc-placeholder-stage.iam.gserviceaccount.com",
    "canary_publisher": "aigc-can-pub@aigc-placeholder-stage.iam.gserviceaccount.com",
    "judge": "aigc-judge@aigc-placeholder-stage.iam.gserviceaccount.com",
    "security_review": "aigc-security@aigc-placeholder-stage.iam.gserviceaccount.com",
    "authority_signer": "aigc-signer@aigc-placeholder-stage.iam.gserviceaccount.com"
  },
  "exact_secret_version_refs": {
    "runtime_control_dsn": "projects/aigc-placeholder-stage/locations/northamerica-northeast1/secrets/placeholder-runtime-control-dsn/versions/1",
    "operator_token": "projects/aigc-placeholder-stage/locations/northamerica-northeast1/secrets/placeholder-operator-token/versions/1",
    "operator_binding_key": "projects/aigc-placeholder-stage/locations/northamerica-northeast1/secrets/placeholder-operator-binding-key/versions/1",
    "runtime_admin_token": "projects/aigc-placeholder-stage/locations/northamerica-northeast1/secrets/placeholder-runtime-admin-token/versions/1",
    "runtime_admin_binding_key": "projects/aigc-placeholder-stage/locations/northamerica-northeast1/secrets/placeholder-runtime-admin-binding-key/versions/1",
    "judge_token": "projects/aigc-placeholder-stage/locations/northamerica-northeast1/secrets/placeholder-judge-token/versions/1",
    "judge_binding_key": "projects/aigc-placeholder-stage/locations/northamerica-northeast1/secrets/placeholder-judge-binding-key/versions/1"
  },
  "supply_chain": {
    "docker_builder_image": "gcr.io/cloud-builders/docker@sha256:0000000000000000000000000000000000000000000000000000000000000000",
    "python_base_image": "python:3.12.13-slim-bookworm@sha256:0000000000000000000000000000000000000000000000000000000000000000",
    "sbom_generator_image": "anchore/syft@sha256:0000000000000000000000000000000000000000000000000000000000000000"
  },
  "reviews": {
    "cloud_run_montreal": false,
    "cloud_sql_montreal": false,
    "cloud_storage_montreal": false,
    "artifact_registry_montreal": false,
    "regional_secret_manager_montreal": false,
    "cloud_kms_montreal": false,
    "cloud_logging_montreal": false,
    "cloud_build_montreal": false,
    "gemini_model_montreal": false,
    "gemini_ml_processing_commitment_reviewed": false,
    "regional_endpoints_reviewed": false,
    "global_control_plane_metadata_reviewed": false,
    "legacy_github_credentials_reviewed_and_revoked_or_proven_inactive": false,
    "iam_least_privilege_reviewed": false,
    "no_service_account_keys_reviewed": false,
    "network_egress_reviewed": false,
    "backup_location_reviewed": false,
    "privacy_impact_assessment_completed": false,
    "cross_border_assessment_completed": false,
    "retention_and_deletion_reviewed": false,
    "incident_and_recovery_reviewed": false,
    "pricing_quote_reviewed": false
  },
  "authority": {
    "configuration_reviewed": false,
    "resource_creation_authorized": false,
    "staging_deployment_authorized": false,
    "production_activation_authorized": false,
    "public_access_authorized": false,
    "live_model_call_authorized": false,
    "judge_publication_authorized": false,
    "devpost_submission_authorized": false,
    "gmail_send_authorized": false,
    "external_business_action_authorized": false,
    "financial_action_authorized": false,
    "cross_region_replication_authorized": false,
    "service_account_key_creation_authorized": false,
    "authorized_by": "",
    "authorized_at": null,
    "expires_at": null,
    "approval_phrase": ""
  },
  "codex_cloud_region_verified_canada": false,
  "local_laptop_required_for_runtime": false,
  "single_physical_server_dependency": false
}
